{
  "name": "wealth",
  "path": "/Users/frunde/Documents/fru/fd-apps/fd-apps-prevail-life/vault-demo/wealth",
  "hasState": true,
  "openLoopCount": 3,
  "stateMtime": 1749220200000,
  "skills": [
    {
      "id": "wealth-op-weekly-pulse",
      "title": "Weekly Wealth Pulse",
      "path": "/Users/frunde/Documents/fru/fd-apps/fd-apps-prevail-life/vault-demo/wealth/skills/wealth-op-weekly-pulse/SKILL.md"
    },
    {
      "id": "connect-financial-institution",
      "title": "Connect Financial Institution",
      "path": "/Users/frunde/Documents/fru/fd-apps/fd-apps-prevail-life/vault-demo/wealth/skills/connect-financial-institution/SKILL.md"
    }
  ]
}
